005:007:001:DESCRIPTOR         1526467522.503384
 05 0D 09 01 A1 01 85 07 09 20 A1 00 09 42 09 44
 09 45 15 00 25 01 75 01 95 03 81 02 95 02 81 03
 09 32 95 01 81 02 95 02 81 03 75 10 95 01 35 00
 A4 05 01 09 30 65 13 55 0D 46 34 03 27 70 C6 00
 00 81 02 09 31 46 4D 04 27 9F 6F 00 00 81 02 B4
 09 30 45 00 26 FF 1F 81 02 C0 C0 09 0E A1 01 85
 05 09 23 A1 02 09 52 09 53 25 0A 75 08 95 02 B1
 02 C0 C0 05 0C 09 36 A1 00 85 06 05 09 19 01 29
 20 15 00 25 01 95 20 75 01 81 02 C0 05 01 09 06
 A1 01 85 03 05 07 19 E0 29 E7 15 00 25 01 75 01
 95 08 81 02 05 07 19 00 29 FF 26 FF 00 75 08 95
 06 81 00 C0

