001:007:000:DESCRIPTOR         1512296551.116092
 05 00 09 00 A1 01 85 92 05 00 09 00 A1 00 09 00
 15 00 26 FF 00 75 08 95 01 81 02 09 00 15 00 26
 FF 00 75 08 95 01 91 02 C0 C0 05 00 09 01 A1 01
 85 84 05 00 09 01 A1 00 09 00 15 00 26 FF 00 75
 08 95 03 81 02 09 00 15 00 26 FF 00 75 08 95 03
 91 02 C0 C0 05 00 09 02 A1 01 85 99 05 00 09 02
 A1 00 09 00 15 00 26 FF 00 75 08 95 20 81 02 09
 00 15 00 26 FF 00 75 08 95 20 91 02 C0 C0 05 00
 09 03 A1 01 85 93 05 00 09 03 A1 00 09 00 15 00
 26 FF 00 75 08 95 02 81 02 09 00 15 00 26 FF 00
 75 08 95 02 91 02 C0 C0 05 00 09 04 A1 01 85 98
 05 00 09 04 A1 00 09 00 15 00 26 FF 00 75 08 95
 08 81 02 09 00 15 00 26 FF 00 75 08 95 08 91 02
 C0 C0 05 01 09 02 A1 01 85 01 09 01 A1 00 05 09
 19 01 29 05 15 00 25 01 75 01 95 05 81 02 75 03
 95 01 81 03 05 01 09 30 09 31 09 38 15 81 25 7F
 75 08 95 03 81 06 05 0C 15 81 25 7F 75 08 95 01
 0A 38 02 81 06 C0 C0 05 0D 09 01 A1 01 85 02 09
 20 A1 00 09 00 15 00 26 FF 00 75 08 95 09 81 02
 09 3F 09 40 15 00 26 FF 00 75 08 95 02 B1 02 C0
 85 05 09 20 A1 00 09 00 15 00 26 FF 00 75 08 95
 07 81 02 C0 85 0A 09 20 A1 00 09 00 15 00 26 FF
 00 75 08 95 07 81 02 C0 C0 05 01 09 06 A1 01 85
 0D 05 07 19 E0 29 E7 15 00 25 01 75 01 95 08 81
 02 75 08 95 01 81 01 05 07 19 00 29 65 15 00 25
 65 75 08 95 05 81 00 C0

