004:004:001:DESCRIPTOR         1431358874.686988
 05 0D 09 01 A1 01 85 07 09 20 A1 00 09 42 09 44
 09 45 15 00 25 01 75 01 95 03 81 02 95 02 81 03
 09 32 95 01 81 02 95 02 81 03 75 10 95 01 35 00
 A4 05 01 09 30 65 13 55 0D 46 A1 03 27 70 C6 00
 00 81 02 09 31 46 04 02 27 10 77 00 00 81 02 B4
 09 30 45 00 26 FF 07 81 02 C0 C0 09 0E A1 01 85
 05 09 23 A1 02 09 52 09 53 25 0A 75 08 95 02 B1
 02 C0 C0 05 01 09 02 A1 01 85 09 09 01 A1 00 05
 09 19 01 29 03 15 00 25 01 95 03 75 01 81 02 95
 05 81 01 05 01 09 30 09 31 26 FF 7F 95 02 75 10
 81 02 05 0D 09 30 26 FF 03 95 01 75 10 81 02 C0
 C0 05 0C 09 36 A1 00 85 06 05 09 19 01 29 20 15
 00 25 01 95 20 75 01 81 02 C0

004:004:000:DESCRIPTOR         1431358874.693251
 05 01 09 02 A1 01 85 08 09 01 A1 00 05 09 19 01
 29 03 15 00 25 01 95 03 75 01 81 02 95 05 81 01
 05 01 09 30 09 31 09 38 09 00 15 81 25 7F 75 08
 95 04 81 06 C0 C0 05 01 09 00 A1 01 85 04 A1 00
 26 FF 00 09 00 75 08 95 07 B1 02 C0 C0

