003:005:002:DESCRIPTOR         1333299578.197559
 05 01 09 06 A1 01 85 03 05 07 19 E0 29 E7 15 00
 25 01 75 01 95 08 81 02 05 07 19 00 29 FF 26 FF
 00 75 08 95 06 81 00 C0 05 0C 09 01 A1 01 85 04
 19 00 2A 3C 02 15 00 26 3C 02 95 01 75 10 81 00
 C0 05 01 09 80 A1 01 85 05 19 81 29 83 15 00 25
 01 75 01 95 03 81 02 95 05 81 01 C0

003:005:001:DESCRIPTOR         1333299578.203060
 05 01 09 02 A1 01 05 01 09 02 A1 02 85 01 09 01
 A1 00 05 09 19 01 29 05 95 05 75 01 15 00 25 01
 81 02 95 03 81 01 05 01 09 30 09 31 16 00 80 26
 FF 7F 75 10 95 02 81 06 A1 02 85 02 09 48 15 00
 25 01 35 01 45 04 95 01 75 02 B1 02 85 01 09 38
 35 00 45 00 15 81 25 7F 75 08 81 06 C0 A1 02 85
 02 09 48 15 00 25 01 35 01 45 04 75 02 B1 02 35
 00 45 00 75 04 B1 01 85 01 05 0C 0A 38 02 15 81
 25 7F 75 08 81 06 C0 C0 C0 C0 06 01 FF 09 00 A1
 01 85 08 15 00 26 FF 00 09 00 75 08 95 05 B1 02
 C0

003:005:000:DESCRIPTOR         1333299578.210047
 05 0D 09 02 A1 01 85 07 09 20 A1 00 09 42 09 43
 09 44 09 44 09 45 15 00 25 01 75 01 95 05 81 02
 95 01 81 03 09 32 95 01 81 02 81 03 05 01 09 30
 75 10 95 01 A4 55 0D 65 13 35 00 46 40 1F 26 00
 7D 81 02 09 31 46 88 13 26 20 4E 81 02 B4 05 0D
 09 30 26 FF 03 46 FF 03 55 00 66 11 E1 75 10 81
 02 C0 C0 05 01 09 02 A1 01 85 09 09 01 A1 00 05
 09 19 01 29 03 15 00 25 01 95 03 75 01 81 02 95
 05 81 01 05 01 09 30 75 10 95 01 A4 35 00 46 00
 7D 26 00 7D 81 02 09 31 46 20 4E 26 20 4E 81 02
 B4 05 0D 09 30 26 FF 03 46 FF 03 55 00 66 11 E1
 75 10 81 02 C0 C0

