001:006:002:DESCRIPTOR         1568360146.932711
 06 0A FF 09 01 A1 01 85 09 09 02 75 08 95 08 15
 00 26 FF 00 81 02 09 03 75 08 95 08 15 00 26 FF
 00 91 02 C0

001:006:001:DESCRIPTOR         1568360146.935742
 05 01 09 06 A1 01 85 03 05 07 19 E0 29 E7 15 00
 25 01 75 01 95 08 81 02 05 07 19 00 29 FF 26 FF
 00 75 08 95 06 81 00 C0

001:006:000:DESCRIPTOR         1568360146.940738
 05 01 09 02 A1 01 85 01 09 01 A1 00 05 09 19 01
 29 03 15 00 25 01 95 03 75 01 81 02 95 05 81 01
 05 01 09 30 09 31 26 FF 7F 95 02 75 10 81 02 05
 0D 09 30 26 FF 1F 95 01 75 10 81 02 C0 C0 05 0D
 09 02 A1 01 85 02 09 20 A1 00 09 42 09 44 09 45
 15 00 25 01 75 01 95 03 81 02 95 02 81 03 09 32
 95 01 81 02 95 02 81 03 75 10 95 01 35 00 A4 05
 01 09 30 65 13 55 0D 46 34 03 27 70 C6 00 00 81
 02 09 31 46 4D 04 27 06 7C 00 00 81 02 B4 09 30
 45 00 26 FF 1F 81 02 C0 C0

