004:002:000:DESCRIPTOR         1303301228.577135
 05 0D 09 02 A1 01 85 07 09 20 A1 00 09 42 09 44
 09 45 15 00 25 01 75 01 95 03 81 02 95 03 81 03
 09 32 95 01 81 02 95 01 81 03 05 01 09 30 75 10
 95 01 A4 55 0D 65 13 35 00 46 10 27 26 20 4E 81
 02 09 31 46 B7 19 26 6E 33 81 02 B4 05 0D 09 30
 26 FF 03 81 02 75 10 C0 C0 05 01 09 02 A1 01 85
 08 09 01 A1 00 05 09 19 01 29 03 15 00 25 01 95
 03 75 01 81 02 95 05 81 01 05 01 09 30 09 31 09
 38 09 00 15 81 25 7F 75 08 95 04 81 06 C0 C0 05
 01 09 02 A1 01 85 09 09 01 A1 00 05 09 19 01 29
 03 15 00 25 01 95 03 75 01 81 02 95 04 81 01 05
 0D 09 32 95 01 81 02 05 01 09 30 75 10 95 01 A4
 55 0D 65 13 35 00 46 10 27 26 20 4E 81 02 09 31
 46 B7 19 26 6E 33 81 02 B4 05 0D 09 30 26 FF 03
 95 01 75 10 81 02 C0 C0 05 01 09 00 A1 01 85 04
 15 00 26 FF 00 09 00 75 08 95 03 B1 02 C0
