006:002:001:DESCRIPTOR         1526447794.381658
 05 0D 09 02 A1 01 85 07 09 20 A1 00 09 42 09 44
 09 45 15 00 25 01 75 01 95 03 81 02 95 02 81 03
 09 32 95 01 81 02 95 02 81 03 75 10 95 01 35 00
 A4 05 01 09 30 46 EF 34 27 73 86 00 00 81 42 09
 31 46 EE 1D 26 05 4C 81 42 B4 09 30 45 00 26 FF
 1F 81 42 09 3D 15 81 25 7F 75 08 95 01 81 02 09
 3E 15 81 25 7F 81 02 C0 C0 05 0D 09 01 A1 01 85
 08 09 20 A1 00 09 42 09 44 09 45 15 00 25 01 75
 01 95 03 81 02 95 02 81 03 09 32 95 01 81 02 95
 02 81 03 75 10 95 01 35 00 A4 05 01 09 30 46 EF
 34 27 73 86 00 00 81 42 09 31 46 EE 1D 26 05 4C
 81 42 B4 09 30 45 00 26 FF 1F 81 42 09 3D 15 81
 25 7F 75 08 95 01 81 02 09 3E 15 81 25 7F 81 02
 C0 C0

